{
  "schema": "afi.cpj.v0.1",
  "provenance": {
    "providerType": "discord",
    "providerId": "discord-server-987654",
    "messageId": "msg-111222",
    "postedAt": "2024-12-16T12:00:00Z",
    "rawText": "ETH SHORT\nEntry: 2250\nSL: 2300\nTP: 2150\nLeverage: 3x",
    "channelName": "trading-signals",
    "authorId": "user-333",
    "authorName": "CryptoWhale"
  },
  "extracted": {
    "symbolRaw": "ETHUSDT",
    "side": "short",
    "entry": 2250,
    "stopLoss": 2300,
    "takeProfits": [
      {
        "price": 2150
      }
    ],
    "leverageHint": 3,
    "marketTypeHint": "perp"
  },
  "parse": {
    "parserId": "discord-signal-parser",
    "parserVersion": "1.0.0",
    "confidence": 0.88,
    "warnings": [
      "No explicit timeframe provided, defaulting to strategy default",
      "No explicit venue provided, will use default routing"
    ]
  }
}

